ministry,publish_date,report_title,contractor_name,department,url
METI,2025-10-31,令和６年度二国間クレジット取得等のためのインフラ整備調査事業費（市場メカニズム交渉等に係る国際動向調査）報告書,一般財団法人日本エネルギー経済研究所,イノベーション・環境局 ＧＸグループ 地球環境対策室,https://www.meti.go.jp/meti_lib/report/2024FY/000290.pdf
METI,2025-10-31,令和6年度法定経営指導員制度評価業務委託事業（経営発達支援計画の過年度計画傾向分析業務調査）報告書,エイチ・エーエル,中小企業庁経営支援部　小規模企業振興課,https://www.meti.go.jp/meti_lib/report/2024FY/000289.pdf
METI,2025-10-31,令和６年度技術開発調査等の推進事業費（あるべきイノベーション政策の検討に向けた調査事業） 　調査報告書,EY税理士法人,イノベーション・環境局研究開発課,https://www.meti.go.jp/meti_lib/report/2024FY/000288.pdf
METI,2025-10-31,令和６年度商取引・サービス環境の適正化に係る事業（再生・細胞分野の国際医療貢献に向けた広報等に関する調査事業）報告書,シード・プランニング,商務・サービスグループ　生物化学産業課,https://www.meti.go.jp/meti_lib/report/2024FY/000286.pdf
METI,2025-10-31,令和6年度「学びと社会の在り方改革推進事業（「未来の教室」実証事業）」成果報告書,博報堂,商務・サービスグループ サービス政策課教育産業室,https://www.meti.go.jp/meti_lib/report/2024FY/000281.pdf
METI,2025-10-15,令和６年度宇宙産業技術情報基盤整備研究開発事業（SERVISプロジェクト）のうち宇宙交通管理等の共通基盤及び人的基盤の強化に資する調査事業 成果報告書,三菱総合研究所,製造産業局 宇宙産業課,https://www.meti.go.jp/meti_lib/report/2024FY/000302.pdf
METI,2025-10-15,令和６年度二国間クレジット取得等のためのインフラ整備調査事業（JCM実現可能性調査業務）報告書,パシフィックコンサルタンツ,GXグループ地球環境対策室,https://www.meti.go.jp/meti_lib/report/2024FY/000287.pdf
METI,2025-10-10,令和6年度産業経済研究委託事業不正競争防止法におけるパブリシティ価値の保護に関する調査研究報告書,ベーカー&マッケンジー法律事務所(外国法共同事業),経済産業政策局知的財産政策室,https://www.meti.go.jp/meti_lib/report/2024FY/000278.pdf
METI,2025-10-10,令和６年度燃料安定供給対策調査等事業（エネルギーに関する国内外の経済社会動向の調査）報告書,日本総合研究所,長官官房　総務課　調査広報室,https://www.meti.go.jp/meti_lib/report/2024FY/000276.pdf
METI,2025-10-10,令和６年度燃料安定供給対策調査等事業（国内外のエネルギー動向に関する調査・分析・制作等）調査報告書,一般財団法人日本エネルギー経済研究所,資源エネルギー庁　長官官房　総務課　調査広報室,https://www.meti.go.jp/meti_lib/report/2024FY/000275.pdf
METI,2025-10-10,令和６年度エネルギー需給構造高度化対策調査等事業（洋上風力導入拡大に向けた国内外動向調査）調査報告書,有限責任監査法人トーマツ,資源エネルギー庁省エネルギー・新エネルギー部新エネルギー課風力政策室,https://www.meti.go.jp/meti_lib/report/2024FY/000273.pdf
METI,2025-10-10,令和6年度技術開発調査等推進事業　大学発ベンチャーの実態などに関する調査,日経BPコンサルティング,イノベーション・環境局 イノベーション政策課 大学連携推進室,https://www.meti.go.jp/meti_lib/report/2024FY/000272.pdf
METI,2025-10-10,令和6年度四国地域におけるシェアリングエコノミーの認知度向上及び導入加速化に関する調査事業報告書,パソナJOBHUB,四国経済産業局　総務企画部　企画調査課,https://www.meti.go.jp/meti_lib/report/2024FY/000271.pdf
METI,2025-10-10,令和６年度持続可能な四国地域を目指した共創型官民連携の「はじまり」に関する調査報告書,ダン計画研究所,四国経済産業局総務企画部企画調査課,https://www.meti.go.jp/meti_lib/report/2024FY/000270.pdf
METI,2025-10-10,令和６年度産業経済研究委託調査事業（企業の組織再編成の実態等に関する調査）経済産業省委託調査報告書,長島・大野・常松法律事務所,経済産業政策局　産業組織課,https://www.meti.go.jp/meti_lib/report/2024FY/000266.pdf
METI,2025-10-10,令和６年度中小企業活性化・事業承継総合支援事業（中小Ｍ＆Ａに係る資格に関する調査事業）調査報告書,PwCコンサルティング合同会社,中小企業庁事業環境部財務課,https://www.meti.go.jp/meti_lib/report/2024FY/000259.pdf
METI,2025-09-29,令和６年度　経済産業省委託　産業保安等技術基準策定調査研究等事業　高圧ガス保安法関連製品販売実態・危険性等調査　報告書,高圧ガス保安協会,大臣官房　産業保安・安全グループ　高圧ガス保安室,https://www.meti.go.jp/meti_lib/report/2024FY/000285.pdf
METI,2025-09-29,令和６年度エネルギー需給構造高度化対策調査等事業（合成メタン（e-methane）等に関する海外の政策動向等及び社会実装の実現・加速化に向けた制度等の検討に関する調査）,みずほリサーチ&テクノロジーズ,資源エネルギー庁電力・ガス事業部ガス市場整備室,https://www.meti.go.jp/meti_lib/report/2024FY/000311.pdf
METI,2025-09-29,令和６年度エネルギー需給構造高度化対策調査等事業 (ガス事業及び熱供給事業に係る事業者別ＣＯ２排出係数の算定・集計・分析等業務),みずほリサーチ&テクノロジーズ,資源エネルギー庁電力・ガス事業部ガス市場整備室,https://www.meti.go.jp/meti_lib/report/2024FY/000310.pdf
METI,2025-09-05,令和6年度重要技術総合管理事業（生物化学産業に係る国内重要物資・技術調査）　報告書,有限責任監査法人トーマツ,商務・サービスグループ　生物化学産業課,https://www.meti.go.jp/meti_lib/report/2024FY/000293.pdf
METI,2025-08-13,資源の安定供給確保における税制度の効果検証等に関する調査【調査報告書】,デロイトトーマツ税理士法人,資源エネルギー庁 資源・燃料部 資源開発課,https://www.meti.go.jp/meti_lib/report/2024FY/1000000.pdf
METI,2025-08-13,令和６年度中小企業対外経済政策推進事業（サイバーインフラ事業者に係わる責務と基本的取り組み等の調査）調査報告書,みずほリサーチ&テクノロジーズ,商務情報政策局サイバーセキュリティ課,https://www.meti.go.jp/meti_lib/report/2024FY/1000001.pdf
METI,2025-08-13,令和５年度補正グローバルサウス未来産業人材育成等事業（中小企業における人権デュー・ディリジェンスに関する実態調査及び普及啓発）委託事業報告書,PwCコンサルティング合同会社,通商政策局ビジネス・人権政策調整室,https://www.meti.go.jp/meti_lib/report/2024FY/1000002.pdf
METI,2025-08-13,"令和５年度補正グローバルサウス未来産業人材育成等事業
人権デュー・ディリジェンスに関する
マネジメントシステム認証の実現可能性調査 報告書",みずほリサーチ&テクノロジーズ,経済産業省　通商政策局　ビジネス・人権政策調整室,https://www.meti.go.jp/meti_lib/report/2024FY/1000003.pdf
METI,2025-08-13,令和６年度技術開発調査等の推進事業費（研究開発事業終了後の実用化状況等に関する追跡調査）報告書,リベルタス・コンサルティング,経済産業省　イノベーション・環境局　研究開発課,https://www.meti.go.jp/meti_lib/report/2024FY/1000004.pdf
METI,2025-08-13,令和６年度国際ルール形成・市場創造型標準化推進事業費（ルール形成戦略に係る調査研究（繊維産業における責任ある企業行動に関するルール形成戦略調査））報告書,EYストラテジーアンドコンサルティング,生活製品課,https://www.meti.go.jp/meti_lib/report/2024FY/1000005.pdf
METI,2025-08-13,令和６年度産業サイバーセキュリティ強靭化事業（サイバー・フィジカル・セキュリティ対策フレームワークの利活用に関する調査）調査報告書,日立製作所,商務情報政策局サイバーセキュリティ課,https://www.meti.go.jp/meti_lib/report/2024FY/1000007.pdf
METI,2025-08-13,令和６年度産業経済研究委託事業（人的資本経営に関する調査及び普及啓発事業）調査報告書,三菱総合研究所,経済産業省経済産業政策局産業人材課,https://www.meti.go.jp/meti_lib/report/2024FY/1000008.pdf
METI,2025-08-13,令和６年度化学物質規制対策（規制化学物質に関する国際的な動向調査）報告書,日本エヌ・ユー・エス,産業保安・安全グループ化学物質管理課,https://www.meti.go.jp/meti_lib/report/2024FY/1000009.pdf
METI,2025-08-13,令和６年度水力発電技術情報等収集調査（水上太陽光実行可能性調査）報告書,一般財団法人新エネルギー財団,資源エネルギー庁電力・ガス事業部電力基盤整備課,https://www.meti.go.jp/meti_lib/report/2024FY/1000010.pdf
METI,2025-08-13,令和５年度水力発電技術情報等収集調査事業（国内外技術情報調査）報告書（公表用）,一般財団法人新エネルギー財団,資源エネルギー庁 電力・ガス事業部 電力基盤整備課,https://www.meti.go.jp/meti_lib/report/2024FY/1000011.pdf
METI,2025-08-13,令和５年度水力発電技術情報等収集調査事業（水力発電の開発・導入のための賦存量等調査）報告書（公表用）,一般財団法人新エネルギー財団,資源エネルギー庁 電力・ガス事業部 電力基盤整備課,https://www.meti.go.jp/meti_lib/report/2024FY/1000012.pdf
METI,2025-08-13,"令和6年度エネルギー需給構造高度化対策調査等事業
（次世代型太陽電池の需要等に関する調査）",ボストン・コンサルティング・グループ,省エネルギー・新エネルギー部　新エネルギー課,https://www.meti.go.jp/meti_lib/report/2024FY/1000013.pdf
METI,2025-08-13,令和６年度産業サイバーセキュリティ強靭化事業（ソフトウェアのセキュリティ確保等に関する調査）報告書,三菱総合研究所,商務情報政策局サイバーセキュリティ課,https://www.meti.go.jp/meti_lib/report/2024FY/1000014.pdf
METI,2025-08-13,令和６年度経済産業政策関係調査事業（民主資本主義国における今後の経済社会運営システムの在り方に関する調査）最終報告書,ボストン・コンサルティング・グループ,大臣官房総務課,https://www.meti.go.jp/meti_lib/report/2024FY/1000015.pdf
METI,2025-08-13,令和６年度中小企業対外経済政策推進事業（半導体産業分野におけるセキュリティガイドラインの整備等に関する調査）報告書,デロイトトーマツサイバー合同会社,商務情報政策局サイバーセキュリティ課,https://www.meti.go.jp/meti_lib/report/2024FY/1000016.pdf
METI,2025-08-13,令和６年度商取引・サービス環境の適正化に係る事業（福祉用具の市場維持・拡大に向けた施策の在り方に関する調査）調査報告書（公表用）,日本総合研究所,商務・サービスグループヘルスケア産業課医療・福祉機器産業室,https://www.meti.go.jp/meti_lib/report/2024FY/1000017.pdf
METI,2025-08-13,令和６年度エネルギー需給構造高度化対策に関する調査等事業（カーボンニュートラル実現に向けた国内外の中長期エネルギー需給動向調査）調査報告書,デロイトトーマツコンサルティング合同会社,資源エネルギー庁長官官房総務課戦略企画室,https://www.meti.go.jp/meti_lib/report/2024FY/1000018.pdf
METI,2025-08-13,令和６年度電力取引監視等業務委託事業（インバランス料金制度等の海外事例調査等事業）調査報告書（公開）,有限責任監査法人トーマツ,電力・ガス取引監視等委員会ネットワーク事業監視課,https://www.meti.go.jp/meti_lib/report/2024FY/1000019.pdf
METI,2025-08-13,"令和６年度非化石エネルギー等導入促進対策調査等委託費
東海地域の産業構造を踏まえたＧＸ推進に係る方策調査・分析　報告書（全体版）",三菱UFJリサーチ&コンサルティング名古屋,中部経済産業局　資源エネルギー環境部　資源エネルギー環境課　カーボンニュートラル推進室,https://www.meti.go.jp/meti_lib/report/2024FY/1000020.pdf
METI,2025-08-13,令和6年度CASE対応に向けた自動車部品サプライヤー事業転換支援事業（地域支援拠点運営事業）～みやぎ自動車産業「ミカタ」プロジェクト～事業報告書,公益財団法人みやぎ産業振興機構,東北経済産業局地域経済部製造産業課,https://www.meti.go.jp/meti_lib/report/2024FY/1000021.pdf
METI,2025-08-13,令和6年度CASE対応に向けた自動車部品サプライヤー事業転換支援事業（地域支援拠点運営事業）～次世代自動車チャレンジ支援事業～報告書,公益財団法人いわて産業振興センター,東北経済産業局地域経済部製造産業課,https://www.meti.go.jp/meti_lib/report/2024FY/1000022.pdf
METI,2025-08-13,令和６年度学生と地域中堅・中小企業との接点強化によるオープンイノベーション加速化調査,PwCコンサルティング合同会社,中部経済産業局 地域経済部 イノベーション推進課,https://www.meti.go.jp/meti_lib/report/2024FY/1000023.pdf
METI,2025-08-13,令和６年度無人自動運転等のCASE対応に向けた実証・支援事業（自動車分野のカーボンニュートラル実現に向けた定量的シナリオ分析及び国際動向に関する調査事業）報告書,一般財団法人日本エネルギー経済研究所,製造産業局自動車課戦略企画室,https://www.meti.go.jp/meti_lib/report/2024FY/1000024.pdf
METI,2025-08-13,令和６年度地域経済産業活性化対策調査事業［中国地域におけるデジタル化・DX支援方策調査］中国地域におけるデジタル化・DX支援方策調査事業報告書,エヌ・ティ・ティ・データ経営研究所,中国経済産業局地域経済部デジタル経済課,https://www.meti.go.jp/meti_lib/report/2024FY/1000025.pdf
METI,2025-08-13,"令和６年度地域の社会課題解決企業支援のためのエコシステム構築実証事業
（地域実証支援を通じたエコシステム調査事業）事業成果報告書",PwCコンサルティング合同会社,中小企業庁 創業・新事業促進室　,https://www.meti.go.jp/meti_lib/report/2024FY/1000027.pdf
METI,2025-08-13,令和６年度産業サイバーセキュリティ強靱化事業（システムやサービスに係る制度の普及促進等に関する調査）調査報告書,みずほリサーチ&テクノロジーズ,商務情報政策局サイバーセキュリティ課,https://www.meti.go.jp/meti_lib/report/2024FY/1000028.pdf
METI,2025-08-13,令和6年度経済産業統計政策調査等事業（発展的政策プロセスの実践に関する人材育成）報告書,東京大学エコノミックコンサルティング,大臣官房調査統計グループデータマネジメント推進室,https://www.meti.go.jp/meti_lib/report/2024FY/1000029.pdf
METI,2025-08-13,令和６年度動静脈連携による地域の資源循環モデル構築の可能性調査（ものづくり企業から考えるサーキュラーエコノミー）調査報告書,デロイトトーマツコンサルティング合同会社,関東経済産業局　資源エネルギー環境部 環境・資源循環経済課,https://www.meti.go.jp/meti_lib/report/2024FY/1000030.pdf
METI,2025-08-13,令和６年度技術開発調査等の推進事業費（博士人材の民間企業における活躍のための手引き・ガイドライン策定に関する調査）報告書,三菱総合研究所,経済産業省イノベーション・環境局イノベーション政策課大学連携推進室,https://www.meti.go.jp/meti_lib/report/2024FY/1000031.pdf
METI,2025-08-13,令和６年度地球温暖化・資源循環対策等調査事業費（特定プラスチック使用製品の使用の合理化に関する施行状況調査）,デロイトトーマツコンサルティング合同会社,イノベーション・環境局GXグループ資源循環経済課,https://www.meti.go.jp/meti_lib/report/2024FY/1000032.pdf
METI,2025-08-13,令和６年度重要技術総合管理事業（医療機器の国際競争力強化及び技術流出防止のための調査）最終報告書,有限責任監査法人トーマツ,商務・サービスグループヘルスケア産業課医療・福祉機器産業室,https://www.meti.go.jp/meti_lib/report/2024FY/1000033.pdf
METI,2025-08-13,令和６年度事業承継・Ｍ＆Ａによる中小企業等のグループ化を通じた生産性向上可能性調査　実施報告書,PwCコンサルティング合同会社,関東経済産業局　産業部　中小企業金融課,https://www.meti.go.jp/meti_lib/report/2024FY/1000034.pdf
METI,2025-08-13,令和６年度産業経済研究委託事業（連系線確保量α、βの適正な算出及び調整力関連データの集約と価格分析に係る調査事業）調査報告書（公開）,有限責任監査法人トーマツ,電力・ガス取引監視等委員会ネットワーク事業監視課,https://www.meti.go.jp/meti_lib/report/2024FY/1000035.pdf
METI,2025-08-13,令和６年度地球温暖化・資源循環対策等調査事業費（産業競争力強化法に基づくエネルギー利用環境負荷低減事業適応の利用状況等に関する調査）報告書,みずほリサーチ&テクノロジーズ,経済産業省ＧＸグループ環境政策課GX推進企画室 ,https://www.meti.go.jp/meti_lib/report/2024FY/1000036.pdf
METI,2025-08-13,令和６年度燃料安定供給対策調査等事業ウクライナ侵略における石炭を通じた多層的なエネルギー供給がエネルギー安全保障に与えた影響分析調査報告書,NTTデータ,経済産業省資源エネルギー庁資源・燃料部資源開発課石炭政策室,https://www.meti.go.jp/meti_lib/report/2024FY/1000037.pdf
METI,2025-08-13,"令和６年度省エネルギー促進に向けた広報事業
(中堅・中小企業の省エネ・非化石転換等GX取組事例に関する調査)
業務報告書",ゼロック,関東経済産業局 資源エネルギー環境部 カーボンニュートラル推進課,https://www.meti.go.jp/meti_lib/report/2024FY/1000042.pdf
METI,2025-08-13,令和６年度エネルギー需給構造高度化基準認証推進事業　我が国工作機械産業の競争力強化に関するルール形成戦略に係る調査　最終報告資料,アーサー・ディ・リトル・ジャパン,製造産業局産業機械課,https://www.meti.go.jp/meti_lib/report/2024FY/000247.pdf
METI,2025-08-13,令和６年度地域経済産業活性化対策調査（地域企業における事業再生に関する課題調査）報告書,東京商工リサーチ,経済産業政策局産業組織課,https://www.meti.go.jp/meti_lib/report/2024FY/1000047.pdf
METI,2025-08-13,令和６年度産業経済研究委託調査事業（事業再生制度の活用企業に関する調査）調査報告書,有限責任監査法人トーマツ,経済産業政策局産業組織課,https://www.meti.go.jp/meti_lib/report/2024FY/1000048.pdf
METI,2025-08-13,令和6年度 経済産業政策関係調査事業(コーポレートガバナンス改革の実質化に向けた調査)報告書,PwCJapan有限責任監査法人,経済産業政策局産業組織課,https://www.meti.go.jp/meti_lib/report/2024FY/1000049.pdf
METI,2025-08-13,令和６年度産業経済研究委託調査事業 日本及び諸外国における役員報酬に係る法人税制及び関係法令等に関する調査報告書,EY弁護士法人,経済産業政策局産業組織課,https://www.meti.go.jp/meti_lib/report/2024FY/1000050.pdf
METI,2025-08-13,令和６年度化学物質規制対策（化審法の運用検討に関する調査事業）報告書,いであ,産業保安・安全グループ化学物質管理課化学物質安全室,https://www.meti.go.jp/meti_lib/report/2024FY/1000051.pdf
METI,2025-08-13,令和６年度エネルギー需給構造高度化基準認証推進事業費（我が国建設機械産業のＧＸ実現及び競争力強化に関するルール形成戦略に係る調査）報告書,デロイトトーマツコンサルティング合同会社,製造産業局産業機械課,https://www.meti.go.jp/meti_lib/report/2024FY/1000052.pdf
METI,2025-08-13,令和６年度燃料安定供給対策調査等事業　石炭からのダイベストメントが我が国の石炭サプライチェーンインフラに与える影響調査報告書,日本総合研究所,経済産業省資源エネルギー庁資源・燃料部資源開発課石炭政策室,https://www.meti.go.jp/meti_lib/report/2024FY/1000056.pdf
METI,2025-08-13,令和６年度石油・ガス供給等に係る保安対策調査等事業（ＬＰガスの自然災害対策・事故原因分析調査）,高圧ガス保安協会,産業保安・安全グループ保安課ガス安全室,https://www.meti.go.jp/meti_lib/report/2024FY/1000058.pdf
METI,2025-08-13,令和6年度中小企業活性化・事業承継総合支援事業（北海道内の自治体等を中心とする中小企業等の事業承継支援に係る調査事業）調査報告書,ビジネスマーケット,経済産業省　北海道経済産業局　産業部　中小企業課,https://www.meti.go.jp/meti_lib/report/2024FY/1000059.pdf
METI,2025-08-13,令和６年度エネルギー需給構造高度化対策に関する調査等事業（同時市場に関する詳細設計等に係る調査等事業）,有限責任監査法人トーマツ,資源エネルギー庁　電力・ガス事業部　政策課　電力産業・市場室,https://www.meti.go.jp/meti_lib/report/2024FY/1000060.pdf
METI,2025-08-13,令和６年度ユニコーン創出支援事業（リーガルサポート等による新事業創出に向けた基盤に関する調査）,野村総合研究所,経済産業政策局産業創造課,https://www.meti.go.jp/meti_lib/report/2024FY/1000061.pdf
METI,2025-08-13,令和６年度内外一体の経済成長戦略構築にかかる国際経済調査事業（主要国・地域における貿易措置等の国際ルール整合性に関する調査）報告書,TMI総合法律事務所,通商政策局国際経済部国際経済紛争対策室,https://www.meti.go.jp/meti_lib/report/2024FY/1000062.pdf
METI,2025-08-13,令和６年度経済産業省デジタルプラットフォーム構築事業（経営力向上計画の制度改善に係る調査及び申請プラットフォームの改修・保守運用事業）調査報告書,TOPPAN,中小企業庁　事業環境部　企画課,https://www.meti.go.jp/meti_lib/report/2024FY/1000063.pdf
METI,2025-08-13,令和６年度経済産業政策関係調査事業（大阪・関西万博に関する相談対応実証事業）,JTBグローバルアシスタンス,商務・サービスグループ文化創造産業課博覧会推進室,https://www.meti.go.jp/meti_lib/report/2024FY/1000064.pdf
METI,2025-08-13,令和６年度「商品先物取引に関する委託者等の実態調査」報告書,リサーチワークス,商務情報政策局商務・サービスグループ商取引監督課 ,https://www.meti.go.jp/meti_lib/report/2024FY/1000066.pdf
METI,2025-08-13,令和６年度新エネルギー等の保安規制高度化事業　新エネルギー技術等の安全な普及のための高圧ガス技術基準策定　報告書,高圧ガス保安協会,大臣官房　産業保安・安全グループ　高圧ガス保安室,https://www.meti.go.jp/meti_lib/report/2024FY/1000068.pdf
METI,2025-08-13,令和 6 年度石油・ガス供給等に係る保安対策調査等事業(高圧ガス設備耐震設計手法のさらなる高度化に向けた調査研究)報告書,高圧ガス保安協会,産業保安・安全グループ高圧ガス保安室,https://www.meti.go.jp/meti_lib/report/2024FY/1000069.pdf
METI,2025-08-13,令和６年度燃料安定供給対策調査等事業（カントリーリスク、資源潜在力と融合した一般炭権益資金調達力指標調査）,日本総合研究所,経済産業省資源エネルギー庁資源・燃料部資源開発課石炭政策室,https://www.meti.go.jp/meti_lib/report/2024FY/1000071.pdf
METI,2025-08-13,令和5年度補正宇宙開発利用推進研究開発（月面におけるエネルギー関連技術開発（技術課題整理））,三菱総合研究所,製造産業局 宇宙産業課,https://www.meti.go.jp/meti_lib/report/2024FY/1000072.pdf
