ministry,publish_date,report_title,contractor_name,department,url
METI,2026-03-03,令和６年度「中国地域における後継者支援コミュニティ構築促進事業」報告書,YMFGZONEプラニング,中国経済産業局 産業部 経営支援課,https://www.meti.go.jp/meti_lib/report/2024FY/000127.pdf
METI,2026-03-03,令和6年度原子力国民理解促進広聴・広報事業(地域将来ビジョン調査・広報事業)報告書,ロフトワーク,資源エネルギー庁電力・ガス事業部放射性廃棄物対策課,https://www.meti.go.jp/meti_lib/report/2024FY/000416.pdf
METI,2026-03-03,令和６年度燃料安定供給対策調査等事業（過疎地等における中長期的な燃料供給網構築に関する調査）報告書,ナビット,資源エネルギー庁資源・燃料部燃料流通政策室,https://www.meti.go.jp/meti_lib/report/2024FY/000414.pdf
METI,2026-03-03,令和6年度燃料安定供給対策調査等事業（石油製品の卸・小売価格モニタリング調査（全国規模価格モニタリング調査（石油製品小売市況調査・石油製品卸売市況調査）））調査報告書,一般財団法人日本エネルギー経済研究所,資源エネルギー庁資源・燃料部燃料流通政策室,https://www.meti.go.jp/meti_lib/report/2024FY/000413.pdf
METI,2026-03-03,令和６年度燃料安定供給対策調査等事業（石油製品の卸・小売価格モニタリング調査（産業用燃料納入価格調査・民生用灯油小売価格調査））調査報告書,一般財団法人日本エネルギー経済研究所,資源エネルギー庁資源・燃料部燃料流通政策室,https://www.meti.go.jp/meti_lib/report/2024FY/000412.pdf
METI,2026-03-03,令和６年度原子力の利用状況等に関する調査（諸外国における原子力発電所の利用に関する事項の調査）報告書,合同会社ニュークリア・テクノロジー・コンサルティング,資源エネルギー庁 電力・ガス事業部　原子力政策課　原子力基盤室,https://www.meti.go.jp/meti_lib/report/2024FY/000406.pdf
METI,2026-03-03,令和６年度脱炭素推進国際会議実施・調査事業　炭素国境調整措置における国内ねじ・ボルト等メーカーの影響範囲等調査,野村総合研究所,製造産業局産業機械課,https://www.meti.go.jp/meti_lib/report/2024FY/000405.pdf
METI,2026-03-03,令和6年度　中小企業政策推進事業委託費（福島県浜通り地方等における復興支援施策の効果測定関連調査事業）,みずほリサーチ&テクノロジーズ,福島復興推進グループ福島新産業・雇用創出推進室,https://www.meti.go.jp/meti_lib/report/2024FY/000403.pdf
METI,2026-03-03,令和６年度技術開発調査等の推進事業（量子コンピュータに係る 産業力強化及びエコシステム構築に向けた調査）最終報告書,デロイトトーマツコンサルティング合同会社,イノベーション・環境局イノベーション政策課,https://www.meti.go.jp/meti_lib/report/2024FY/000401.pdf
METI,2026-03-02,令和６年度 流通・物流の効率化・付加価値創出に係る基盤構築事業（流通レジリエンス実現に向けた持続可能な物流ネットワークの構築事業）報告書,公益財団法人流通経済研究所,商務・サービスグループ流通政策課,https://www.meti.go.jp/meti_lib/report/2024FY/000400.pdf
METI,2026-03-02,令和６年度流通・物流の効率化・付加価値創出に係る基盤構築事業（消費財サプライチェーンにおける標準事業所コード活用ルール検討）報告書,公益財団法人流通経済研究所,商務・サービスグループ流通政策課,https://www.meti.go.jp/meti_lib/report/2024FY/000399.pdf
METI,2026-03-02,令和６年度流通・物流の効率化・付加価値創出に係る基盤構築事業（買物弱者対策に向けた新たな流通のあり方に関する課題調査・コンテスト実施）最終報告書,みずほリサーチ&テクノロジーズ,商務・サービスグループ流通政策課,https://www.meti.go.jp/meti_lib/report/2024FY/000398.pdf
METI,2026-03-02,令和６年度地域経済産業活性化対策調査（多様な人材が輝く包摂的な社会の実現に向けた雇用環境等調査事業）調査報告書,公益財団法人九州経済調査協会,九州経済産業局総務企画部企画調査課,https://www.meti.go.jp/meti_lib/report/2024FY/000397.pdf
METI,2026-03-02,令和６年度内外一体の経済成長戦略構築に係る国際経済調査事業（先端半導体の生産施設整備事業及び次世代半導体の研究開発事業の効果検証等に関する委託調査事業）調査報告書,EY税理士法人,商務情報政策局情報産業課,https://www.meti.go.jp/meti_lib/report/2024FY/000395.pdf
METI,2026-03-02,令和6年度エネルギー需給構造高度化対策調査等事業（省エネ法に基づく定期報告書等の分析・情報提供事業）報告書,野村総合研究所,資源エネルギー庁 省エネルギー・新エネルギー部 省エネルギー課,https://www.meti.go.jp/meti_lib/report/2024FY/000394.pdf
METI,2026-03-02,令和６年度地球温暖化問題等対策調査事業費（動静脈連携による自律型資源循環システム構築のための調査）報告書,三菱総合研究所,イノベーション・環境局GXグループ資源循環経済課,https://www.meti.go.jp/meti_lib/report/2024FY/000392.pdf
METI,2026-03-02,令和６年度新エネルギー等保安規制高度化事業費（ＣＣＳ事業に関する保安規制の具体化のための検討に係る調査）報告書,一般財団法人エンジニアリング協会,産業保安・安全グループ鉱山・火薬類監理官付,https://www.meti.go.jp/meti_lib/report/2024FY/000390.pdf
METI,2026-03-02,令和6年度休廃止鉱山における坑廃水処理の高度化技術調査事業 調査報告書,独立行政法人エネルギー・金属鉱物資源機構,産業保安・安全グループ鉱山・火薬類監理官付,https://www.meti.go.jp/meti_lib/report/2024FY/000389.pdf
METI,2026-03-02,令和6年度流通・物流の効率化・付加価値創出に係る基盤構築事業（フィジカルインターネット実現等に向けた物流効率化推進に関する調査研究）報告書,ボストン・コンサルティング・グループ,商務・サービスグループ物流企画室,https://www.meti.go.jp/meti_lib/report/2024FY/000385.pdf
METI,2026-02-02,令和６年度地球温暖化問題等対策調査事業（国際資源循環及びプラスチック汚染関連動向調査）報告書,JFEテクノリサーチ,イノベーション・環境局GXグループ　資源循環経済課,https://www.meti.go.jp/meti_lib/report/2024FY/000388.pdf
METI,2026-02-02,令和６年度商取引・サービス環境の適正化に係る事業（国内外のスポーツリーグ・クラブのパートナーシップ形成に資する実態調査事業）調査報告書,エヌ・ティ・ティ・データ経営研究所,商務・サービスグループ　サービス政策課スポーツ産業室,https://www.meti.go.jp/meti_lib/report/2024FY/000384.pdf
METI,2026-02-02,令和６年度エネルギー需給構造高度化対策調査等事業（ZEH・ZEB・ZEH-Mの普及拡大に係る調査）報告書,野村総合研究所,資源エネルギー庁省エネルギー・新エネルギー部省エネルギー課,https://www.meti.go.jp/meti_lib/report/2024FY/000383.pdf
METI,2026-02-02,令和６年度商取引・サービス環境の適正化に係る事業（医療機器産業ビジョンの具体化に向けた海外展開促進等に関する調査）報告書,みずほリサーチ&テクノロジーズ,商務情報政策局商務・サービスグループヘルスケア産業課医療・福祉機器産業室,https://www.meti.go.jp/meti_lib/report/2024FY/000382.pdf
METI,2026-02-02,令和 6 年度地域のデザインリテラシー向上に向けた、インタウンデザイナーと自治体等の地域活性化に取り組む主体をつなぐ「ナレッジシェア・ポート(知識移転の場)創出」実証調査事業　ガイドブック,合同会社運動,東北経済産業局総務企画部企画調査課,https://www.meti.go.jp/meti_lib/report/2024FY/000371.pdf
METI,2026-02-02,令和 6 年度地域のデザインリテラシー向上に向けた、インタウンデザイナーと自治体等の地域活性化に取り組む主体をつなぐ「ナレッジシェア・ポート(知識移転の場)創出」実証調査事業　報告書,合同会社運動,東北経済産業局総務企画部企画調査課,https://www.meti.go.jp/meti_lib/report/2024FY/000370.pdf
METI,2026-02-02,令和６年度サーキュラーエコノミー実現に向けたRethink Designを軸とする動静脈連携の在り方に関する調査,ダン計画研究所,近畿経済産業局 資源エネルギー環境部　環境・資源循環経済課,https://www.meti.go.jp/meti_lib/report/2024FY/000369.pdf
METI,2026-02-02,令和6年度原子力産業基盤強化事業（原子力分野における国際協力枠組み等に関する調査）報告書,日本エヌ・ユー・エス,資源エネルギー庁 電力・ガス事業部 原子力政策課,https://www.meti.go.jp/meti_lib/report/2024FY/000362.pdf
METI,2026-02-02,令和６年度原子力産業基盤強化事業（一般産業用工業品の放射線環境下の使用指針の整備事業）事業報告書,神戸製鋼所,資源エネルギー庁電気・ガス事業部原子力政策課,https://www.meti.go.jp/meti_lib/report/2024FY/000361.pdf
METI,2026-02-02,令和6年度成長型中小企業等研究開発支援事業(中小企業のイノベーション創出を支援する「イノベーション・プロデューサー」による活動支援実証事業:実証事務局)報告書,ロフトワーク,中小企業庁経営支援部技術・経営革新室,https://www.meti.go.jp/meti_lib/report/2024FY/000360.pdf
METI,2026-02-02,令和６年度国際ルール形成・市場創造型標準化推進事業費（ルール形成戦略に係る調査研究（宇宙環境保全のルール形成戦略に係る調査研究））調査報告書,学校法人日本大学,製造産業局宇宙産業課,https://www.meti.go.jp/meti_lib/report/2024FY/000359.pdf
METI,2026-02-02,令和６年度皮革産業振興対策調査等（日本製皮革及び皮革製品のサステナビリティ推進事業）事業実施報告書,ワンオー,製造産業局生活製品課,https://www.meti.go.jp/meti_lib/report/2024FY/000358.pdf
METI,2026-02-02,令和６年度流通・物流の効率化・付加価値創出に係る基盤構築事業（消費財の流通における商品情報授受の実態調査・データ連携促進事業）報告書,シグマクシス,商務・サービスグループ消費・流通政策課,https://www.meti.go.jp/meti_lib/report/2024FY/000354.pdf
METI,2026-02-02,令和6年度原子力利用状況等調査事業（国内外の原子力人材に関する調査）調査報告書,有限責任監査法人トーマツ,経済産業省資源エネルギー庁電力・ガス事業部原子力政策課,https://www.meti.go.jp/meti_lib/report/2024FY/000352.pdf
METI,2025-12-26,令和６年度エネルギー需給構造高度化対策調査等事業（特定荷主等のエネルギーの使用合理化・非化石転換等の現状分析調査）,野村総合研究所,資源エネルギー庁 省エネルギー・新エネルギー部 省エネルギー課,https://www.meti.go.jp/meti_lib/report/2024FY/000350.pdf
METI,2025-12-26,令和6年度エネルギー需給構造高度化対策調査等事業（工場等及び荷主の判断基準遵守状況等の電子データ化調査事業）報告書,カンテック,資源エネルギー庁 省エネルギー・新エネルギー部 省エネルギー課,https://www.meti.go.jp/meti_lib/report/2024FY/000349.pdf
METI,2025-12-26,令和6年度宇宙産業技術情報基盤整備研究開発事業（SERVISプロジェクト）のうち宇宙戦略基金に係るEBPMに関する調査事業　調査報告書,有限責任監査法人トーマツ,製造産業局 宇宙産業課,https://www.meti.go.jp/meti_lib/report/2024FY/000348.pdf
METI,2025-12-26,令和６年度産業経済研究委託事業（インパクトスタートアップの官民連携にかかる調査研究）調査報告書,PwCコンサルティング合同会社,イノベーション環境局イノベーション創出新事業推進課スタートアップ推進室,https://www.meti.go.jp/meti_lib/report/2024FY/000347.pdf
METI,2025-12-26,令和６年度製造業における外国人材受入れ支援事業事業報告書,三菱UFJリサーチ&コンサルティング,製造産業局総務課,https://www.meti.go.jp/meti_lib/report/2024FY/000346.pdf
METI,2025-12-26,令和６年度固定価格買取制度等効率的・安定的運用業務事業（ITテクノロジーを活用した再エネ発電設備の設置状況や稼働状況の確認に関する調査）報告書,パスコ,資源エネルギー庁省エネルギー・新エネルギー部新エネルギー課再生可能エネルギー推進,https://www.meti.go.jp/meti_lib/report/2024FY/000345.pdf
METI,2025-12-26,令和６年度地域共生再生可能エネルギー発電設備導入実態調査事業（地域共生再生可能エネルギー発電設備導入状況実態調査）報告書,一般社団法人構造耐力評価機構,資源エネルギー庁省エネルギー・新エネルギー部新エネルギー課再生可能エネルギー推進室,https://www.meti.go.jp/meti_lib/report/2024FY/000344.pdf
METI,2025-12-26,令和６年度エネルギー需給構造高度化対策調査等事業（産業・業務部門における更なる省エネの促進に向けた省エネ法関連制度に関する調査）報告書,野村総合研究所,資源エネルギー庁省エネルギー・新エネルギー部省エネルギー課,https://www.meti.go.jp/meti_lib/report/2024FY/000341.pdf
METI,2025-12-26,令和６年度エネルギー需給構造高度化対策調査等事業(家庭部門におけるエネルギー小売事業者等による省エネ促進手法に関する調査)業務報告書,三菱UFJリサーチ&コンサルティング,資源エネルギー庁省エネルギー・新エネルギー部省エネルギー課,https://www.meti.go.jp/meti_lib/report/2024FY/000340.pdf
METI,2025-12-26,令和6年度ヘルスケア産業基盤高度化推進事業（職域におけるヘルスケア産業推進事業）報告書,日本総合研究所,商務・サービスグループ　ヘルスケア産業課,https://www.meti.go.jp/meti_lib/report/2024FY/000338.pdf
METI,2025-12-26,令和６年度地域共生再生可能エネルギー発電設備導入実態調査事業（再生可能エネルギー発電設備の不適切事案に対する行政執行事務の適正かつ効率的な管理に向けた調査事業）調査報告書,EYストラテジーアンドコンサルティング,資源エネルギー庁省エネルギー・新エネルギー部新エネルギー課再生可能エネルギー推進室,https://www.meti.go.jp/meti_lib/report/2024FY/000336.pdf
METI,2025-12-26,令和６年度固定価格買取制度等効率的・安定的運用業務事業（適正な再生可能エネルギーの導入等に関する調査）報告書,EYストラテジーアンドコンサルティング,資源エネルギー庁省エネルギー・新エネルギー部新エネルギー課再生可能エネルギー推進室,https://www.meti.go.jp/meti_lib/report/2024FY/000335.pdf
METI,2025-12-26,令和６年度固定価格買取制度等効率的・安定的運用業務事業（固定価格買取制度等における認定審査等の効率化支援業務）調査報告書,リクルートスタッフィング,資源エネルギー庁省エネルギー・新エネルギー部新エネルギー課再生可能エネルギー推進室,https://www.meti.go.jp/meti_lib/report/2024FY/000334.pdf
METI,2025-11-28,令和６年度　関西における GX 産業立地ポテンシャル調査事業　報告書,有限責任監査法人トーマツ,近畿経済産業局　資源エネルギー環境部　カーボンニュートラル推進室,https://www.meti.go.jp/meti_lib/report/2024FY/000206.pdf
METI,2025-11-28,令和６年度中堅・中小企業のGX 促進に向けた面的支援事例分析調査 報告書,テクノバ,"近畿経済産業局 資源エネルギー環境部　資源エネルギー環境課,カーボンニュートラル推進室",https://www.meti.go.jp/meti_lib/report/2024FY/000205.pdf
METI,2025-11-28,令和６年度燃料安定供給対策調査等事業(潤滑油産業のカーボンニュートラル化に関する取り組み動向調査・分析及びロードマップ策定事業),一般社団法人潤滑油協会,資源エネルギー庁資源・燃料部燃料供給基盤整備課,https://www.meti.go.jp/meti_lib/report/2024FY/000355.pdf
METI,2025-11-28,令和６年度製造基盤技術実態等調査事業（繊維産地におけるサプライチェーン構造調査）調査報告書,三菱UFJリサーチ&コンサルティング,製造産業局生活製品課,https://www.meti.go.jp/meti_lib/report/2024FY/000328.pdf
METI,2025-11-28,令和６年度再生可能エネルギー導入拡大・分散型エネルギーリソース導入支援等事業（定置用蓄電システム等電力貯蔵システムの普及拡大に向けた調査）報告書,三菱総合研究所,資源エネルギー庁省エネルギー・新エネルギー部エネルギーシステム課,https://www.meti.go.jp/meti_lib/report/2024FY/000325.pdf
METI,2025-11-28,令和６年度再生可能エネルギー導入拡大・分散型エネルギーリソース導入支援等事業（地域共生型再生可能エネルギー顕彰事業）調査報告書,EY新日本有限責任監査法人,資源エネルギー庁省エネルギー・新エネルギー部新エネルギーシステム課,https://www.meti.go.jp/meti_lib/report/2024FY/000324.pdf
METI,2025-11-28,令和６年度インバウンド富裕層に対する中部地域のホンモノ体験コンテンツの需要開拓を促進するモデル構築調査 事業実施報告書,エヌ・ティ・ティ・コミュニケーションズ,中部経済産業局　産業部　流通・サービス産業課,https://www.meti.go.jp/meti_lib/report/2024FY/000321.pdf
METI,2025-11-28,令和６年度エネルギー需給構造高度化対策調査等事業（FIT/FIP制度におけるバイオマス発電に用いる燃料の持続可能性及びGHG排出量基準等に関する調査）,三菱総合研究所,資源エネルギー庁　省エネルギー・新エネルギー部　新エネルギー課,https://www.meti.go.jp/meti_lib/report/2024FY/000320.pdf
METI,2025-11-28,令和６年度水力発電技術情報等収集調査事業（河川流量等データ一元化）調査報告書,ジャパン・コンピュータ・テクノロジー,資源エネルギー庁　省エネルギー・新エネルギー部　新エネルギー課,https://www.meti.go.jp/meti_lib/report/2024FY/000319.pdf
METI,2025-11-28,令和６年度「技術開発調査等推進事業（ヘルスケアスタートアップの成長及び出口戦略に関する調査事業）」報告書,ボストン・コンサルティング・グループ,商務・サービスグループヘルスケア産業課,https://www.meti.go.jp/meti_lib/report/2024FY/000317.pdf
METI,2025-11-28,令和６年度固定価格買取制度等の効率的・安定的な運用のための業務（近畿経済産業局の固定価格買取制度等における事業計画実施等の適正化事業）報告書,地域計画建築研究所,近畿経済産業局資源エネルギー環境部エネルギー対策課,https://www.meti.go.jp/meti_lib/report/2024FY/000316.pdf
METI,2025-11-28,令和６年度ヘルスケア産業基盤高度化推進事業（健康経営における女性の健康関連施策の効果検証設計構築等事業）最終報告書,ボストン・コンサルティング・グループ,商務・サービスグループヘルスケア産業課,https://www.meti.go.jp/meti_lib/report/2024FY/000315.pdf
METI,2025-11-28,令和6年度ヘルスケア産業基盤高度化推進事業（医療機関におけるPHR利活用推進等に向けた実証調査事業）報告書,ボストン・コンサルティング・グループ,商務・サービスグループ ヘルスケア産業課,https://www.meti.go.jp/meti_lib/report/2024FY/000313.pdf
METI,2025-11-28,令和６年度ヘルスケア産業基盤高度化推進事業（ＰＨＲ基本的指針、医療情報関連ガイドライン及び消費者向け遺伝子検査ビジネスのあり方に関する調査）報告書,エヌ・ティ・ティ・データ経営研究所,商務・サービスグループ ヘルスケア産業課,https://www.meti.go.jp/meti_lib/report/2024FY/000312.pdf
METI,2025-11-28,令和６年度「ヘルスケア産業基盤高度化推進事業（ヘルスケアビジネス創出推進事業）」報告書,ボストン・コンサルティング・グループ,商務・サービスグループヘルスケア産業課,https://www.meti.go.jp/meti_lib/report/2024FY/000309.pdf
METI,2025-11-28,令和６年度商取引・サービス環境の適正化に係る事業（化粧品におけるOEM/ODM/原料製造の市場動向及び今後の海外展開に係る調査）最終報告資料,有限責任あずさ監査法人,商務・サービスグループ生物化学産業課,https://www.meti.go.jp/meti_lib/report/2024FY/000308.pdf
METI,2025-11-28,企業の復旧事例集～令和6年　能登半島地震の実例から学ぶ～,西日本電信電話東海支店,中部経済産業局総務企画部総務課,https://www.meti.go.jp/meti_lib/report/2024FY/000306.pdf
METI,2025-11-28,レジリエンス向上ステップアップガイドー令和6年のと半島地震の経験から学ぶー,西日本電信電話東海支店,中部経済産業局総務企画部総務課,https://www.meti.go.jp/meti_lib/report/2024FY/000305.pdf
METI,2025-11-28,令和6年能登半島地震の経験を踏まえた中部ものづくり産業レジリエンス手法提案事業　報告書,西日本電信電話東海支店,中部経済産業局総務企画部総務課,https://www.meti.go.jp/meti_lib/report/2024FY/000304.pdf
METI,2025-11-28,令和６年度電力市場監視機能強化等事業（電気事業法に基づく監査における業務調査事業）実施結果報告書,有限責任監査法人トーマツ,電力・ガス取引監視等委員会事務局総務課総合監査室,https://www.meti.go.jp/meti_lib/report/2024FY/000303.pdf
METI,2025-11-21,令和６年度「ヘルスケア産業基盤高度化推進事業（地域におけるヘルスケア産業推進事業）」報告書,日本総合研究所,商務・サービスグループ ヘルスケア産業課,https://www.meti.go.jp/meti_lib/report/2024FY/000391.pdf
METI,2025-10-31,令和６年度エネルギー需給高度化対策に関する調査等委託事業（ガス小売全面自由化広報フォローアップ調査）報告書,矢野経済研究所,資源エネルギー庁電力・ガス事業部ガス市場整備室,https://www.meti.go.jp/meti_lib/report/2024FY/000330.pdf
METI,2025-10-31,令和６年度エネルギー需給構造高度化対策調査等事業（工場等におけるエネルギーの使用状況及び管理実態に関する調査事業）調査報告書,一般財団法人省エネルギーセンター,源エネルギー庁　省エネルギー・新エネルギー部　省エネルギー課,https://www.meti.go.jp/meti_lib/report/2024FY/000301.pdf
METI,2025-10-31,令和６年度原子力の利用状況等に関する調査事業（海外諸国の処理水の取扱い状況及び原発廃炉に際しての利害関係者との関わり方並びに多核種除去設備等処理水の処分技術等に関する調査等） 報告書,日本エヌ・ユー・エス,資源エネルギー庁電力・ガス事業部原子力政策課原子力発電所事故収束対応室,https://www.meti.go.jp/meti_lib/report/2024FY/000300.pdf
METI,2025-10-31,令和６年度重要技術総合管理事業（主要国の人材管理を中心とする技術流出防止策に関する調査）最終報告書,PwCコンサルティング合同会社,貿易経済安全保障局経済安全保障政策課技術調査・流出対策室,https://www.meti.go.jp/meti_lib/report/2024FY/000298.pdf
METI,2025-10-31,令和6年度スポーツチームのローカルゼブラ企業化を目指す、東北地域の可能性調査　調査報告書,官民連携事業研究所,東北経済産業局産業部商業・流通サービス産業課,https://www.meti.go.jp/meti_lib/report/2024FY/000296.pdf
METI,2025-10-31,令和６年度我が国におけるデジタル社会の形成に向けた基盤整備のための調査事業（中堅・中小企業等のＤＸの更なる加速に向けた調査）報告書,EYストラテジーアンドコンサルティング,商務情報政策局　情報技術利用促進課,https://www.meti.go.jp/meti_lib/report/2024FY/000292.pdf
METI,2025-10-31,令和６年度二国間クレジット取得等インフラ整備調査事業費（ＣＤＭの運用に係る方法論に関する調査）報告書,三菱総合研究所,イノベーション・環境局 ＧＸグループ 地球環境対策室,https://www.meti.go.jp/meti_lib/report/2024FY/000291.pdf
